{
  "$schema": "https://json-schema.org/draft/2020-12/schema",
  "$id": "https://github.com/lore2mud/lore2mud/schemas/capability_authoring_result.schema.json",
  "title": "Lore2MUD CapabilityAuthoringResult v1",
  "description": "The frozen public capability authoring envelope returned by the Python SDK and structured CLI. It is a separate envelope from authoring_result.schema.json and must not alter it.",
  "type": "object",
  "additionalProperties": false,
  "required": [
    "format_version",
    "kind",
    "operation",
    "status",
    "artifact",
    "diagnostics",
    "exit_code"
  ],
  "properties": {
    "format_version": {"const": 1},
    "kind": {"const": "capability_authoring_result"},
    "operation": {
      "enum": [
        "create_project",
        "validate_blueprint",
        "validate_project",
        "build_preview",
        "simulate",
        "replay",
        "proof"
      ]
    },
    "status": {"enum": ["success", "rejected"]},
    "artifact": {
      "oneOf": [
        {"type": "null"},
        {
          "$ref": "https://github.com/lore2mud/lore2mud/schemas/capability_preview.schema.json"
        },
        {
          "$ref": "https://github.com/lore2mud/lore2mud/schemas/capability_simulation_report.schema.json"
        },
        {
          "$ref": "https://github.com/lore2mud/lore2mud/schemas/capability_proofing_projection.schema.json"
        }
      ]
    },
    "diagnostics": {
      "type": "array",
      "maxItems": 4096,
      "items": {
        "$ref": "https://github.com/lore2mud/lore2mud/schemas/authoring_diagnostic.schema.json"
      }
    },
    "exit_code": {"enum": [0, 1]}
  },
  "allOf": [
    {
      "if": {
        "properties": {"status": {"const": "success"}},
        "required": ["status"]
      },
      "then": {
        "properties": {
          "artifact": {"not": {"type": "null"}},
          "diagnostics": {"maxItems": 0},
          "exit_code": {"const": 0}
        }
      },
      "else": {
        "properties": {
          "artifact": {"type": "null"},
          "diagnostics": {"minItems": 1},
          "exit_code": {"const": 1}
        }
      }
    }
  ]
}
